{
  "schema_version": "2.0.0",
  "mode": "SHADOW",
  "governs_generation": false,
  "status": "PASS",
  "coverage": {
    "P0": {
      "required": 9,
      "preserved": 9,
      "ratio": 1.0
    },
    "PR0": {
      "required": 1,
      "preserved": 1,
      "ratio": 1.0
    },
    "PR1": {
      "required": 0,
      "preserved": 0,
      "ratio": 1.0
    },
    "LOCK": {
      "required": 4,
      "preserved": 4,
      "ratio": 1.0
    }
  },
  "counts": {
    "equivalent": 38,
    "omission": 0,
    "weakening": 0,
    "contradiction": 0,
    "unauthorized_addition": 0
  },
  "unresolved_required_mappings": 0,
  "issues": [],
  "results": [
    {
      "constraint_id": "action:hidden_01",
      "classification": "equivalent",
      "priority": "P5-D",
      "cgc_ref": "stable_cgc#/scene_intelligence",
      "source_value": "UNKNOWN_LOCKED",
      "target_value": "UNKNOWN_LOCKED",
      "expected_lock_ids": [],
      "actual_lock_ids": [],
      "source_refs": [
        {
          "artifact": "sar2",
          "collection": "action_plan",
          "id": "hidden_01"
        },
        {
          "artifact": "sar2",
          "collection": "entities",
          "id": "hidden_01"
        },
        {
          "artifact": "vsg",
          "collection": "nodes",
          "id": "hidden_01"
        }
      ],
      "target_refs": [
        {
          "artifact": "sar2",
          "collection": "action_plan",
          "id": "hidden_01"
        },
        {
          "artifact": "sar2",
          "collection": "entities",
          "id": "hidden_01"
        },
        {
          "artifact": "vsg",
          "collection": "nodes",
          "id": "hidden_01"
        }
      ],
      "trace_event_ids": []
    },
    {
      "constraint_id": "action:left_facades_01",
      "classification": "equivalent",
      "priority": "P0",
      "cgc_ref": "stable_cgc#/scene_intelligence",
      "source_value": "PRESERVE_EXACT",
      "target_value": "PRESERVE_EXACT",
      "expected_lock_ids": [
        "GL-GEO-LEFT_FACADES_01"
      ],
      "actual_lock_ids": [
        "GL-GEO-LEFT_FACADES_01"
      ],
      "source_refs": [
        {
          "artifact": "sar2",
          "collection": "action_plan",
          "id": "left_facades_01"
        },
        {
          "artifact": "sar2",
          "collection": "entities",
          "id": "left_facades_01"
        },
        {
          "artifact": "vsg",
          "collection": "nodes",
          "id": "left_facades_01"
        }
      ],
      "target_refs": [
        {
          "artifact": "sar2",
          "collection": "action_plan",
          "id": "left_facades_01"
        },
        {
          "artifact": "sar2",
          "collection": "entities",
          "id": "left_facades_01"
        },
        {
          "artifact": "vsg",
          "collection": "nodes",
          "id": "left_facades_01"
        }
      ],
      "trace_event_ids": []
    },
    {
      "constraint_id": "action:occluder_01",
      "classification": "equivalent",
      "priority": "P0",
      "cgc_ref": "stable_cgc#/scene_intelligence",
      "source_value": "PRESERVE_EXACT",
      "target_value": "PRESERVE_EXACT",
      "expected_lock_ids": [
        "GL-GEO-OCCLUDER_01"
      ],
      "actual_lock_ids": [
        "GL-GEO-OCCLUDER_01"
      ],
      "source_refs": [
        {
          "artifact": "sar2",
          "collection": "action_plan",
          "id": "occluder_01"
        },
        {
          "artifact": "sar2",
          "collection": "entities",
          "id": "occluder_01"
        },
        {
          "artifact": "vsg",
          "collection": "nodes",
          "id": "occluder_01"
        }
      ],
      "target_refs": [
        {
          "artifact": "sar2",
          "collection": "action_plan",
          "id": "occluder_01"
        },
        {
          "artifact": "sar2",
          "collection": "entities",
          "id": "occluder_01"
        },
        {
          "artifact": "vsg",
          "collection": "nodes",
          "id": "occluder_01"
        }
      ],
      "trace_event_ids": []
    },
    {
      "constraint_id": "action:right_facades_01",
      "classification": "equivalent",
      "priority": "P0",
      "cgc_ref": "stable_cgc#/scene_intelligence",
      "source_value": "PRESERVE_EXACT",
      "target_value": "PRESERVE_EXACT",
      "expected_lock_ids": [
        "GL-GEO-RIGHT_FACADES_01"
      ],
      "actual_lock_ids": [
        "GL-GEO-RIGHT_FACADES_01"
      ],
      "source_refs": [
        {
          "artifact": "sar2",
          "collection": "action_plan",
          "id": "right_facades_01"
        },
        {
          "artifact": "sar2",
          "collection": "entities",
          "id": "right_facades_01"
        },
        {
          "artifact": "vsg",
          "collection": "nodes",
          "id": "right_facades_01"
        }
      ],
      "target_refs": [
        {
          "artifact": "sar2",
          "collection": "action_plan",
          "id": "right_facades_01"
        },
        {
          "artifact": "sar2",
          "collection": "entities",
          "id": "right_facades_01"
        },
        {
          "artifact": "vsg",
          "collection": "nodes",
          "id": "right_facades_01"
        }
      ],
      "trace_event_ids": []
    },
    {
      "constraint_id": "directive:forbid",
      "classification": "equivalent",
      "priority": "REQUIRED",
      "cgc_ref": "stable_cgc#/forbid",
      "source_value": [
        "Invent exact lettering from unreadable small source text or extrapolate architecture beyond the crop.",
        "Remove, move, shrink or make occluder_01 transparent; change camera to expose hidden_01.",
        "Reveal or invent exact objects, text, vehicle, facade or geometry behind occluder_01.",
        "Use Archive/reference evidence or generic continuity to fill hidden_01; no reconstruction or minimum-continuity synthesis is authorized.",
        "break_protected_relationships:hidden_01",
        "break_protected_relationships:occluder_01",
        "resolve_exact_unknown:hidden_01"
      ],
      "target_value": [
        "Invent exact lettering from unreadable small source text or extrapolate architecture beyond the crop.",
        "Remove, move, shrink or make occluder_01 transparent; change camera to expose hidden_01.",
        "Reveal or invent exact objects, text, vehicle, facade or geometry behind occluder_01.",
        "Use Archive/reference evidence or generic continuity to fill hidden_01; no reconstruction or minimum-continuity synthesis is authorized.",
        "break_protected_relationships:hidden_01",
        "break_protected_relationships:occluder_01",
        "resolve_exact_unknown:hidden_01"
      ],
      "expected_lock_ids": [],
      "actual_lock_ids": [],
      "source_refs": [],
      "target_refs": [
        {
          "artifact": "generation_context",
          "collection": "$",
          "id": "directives"
        },
        {
          "artifact": "sar2",
          "collection": "action_plan",
          "id": "hidden_01"
        },
        {
          "artifact": "sar2",
          "collection": "action_plan",
          "id": "left_facades_01"
        },
        {
          "artifact": "sar2",
          "collection": "action_plan",
          "id": "occluder_01"
        },
        {
          "artifact": "sar2",
          "collection": "action_plan",
          "id": "right_facades_01"
        }
      ],
      "trace_event_ids": []
    },
    {
      "constraint_id": "directive:infer",
      "classification": "equivalent",
      "priority": "REQUIRED",
      "cgc_ref": "stable_cgc#/infer",
      "source_value": [],
      "target_value": [],
      "expected_lock_ids": [],
      "actual_lock_ids": [],
      "source_refs": [],
      "target_refs": [
        {
          "artifact": "generation_context",
          "collection": "$",
          "id": "directives"
        },
        {
          "artifact": "sar2",
          "collection": "action_plan",
          "id": "hidden_01"
        },
        {
          "artifact": "sar2",
          "collection": "action_plan",
          "id": "left_facades_01"
        },
        {
          "artifact": "sar2",
          "collection": "action_plan",
          "id": "occluder_01"
        },
        {
          "artifact": "sar2",
          "collection": "action_plan",
          "id": "right_facades_01"
        }
      ],
      "trace_event_ids": []
    },
    {
      "constraint_id": "directive:preserve",
      "classification": "equivalent",
      "priority": "REQUIRED",
      "cgc_ref": "stable_cgc#/preserve",
      "source_value": [
        "Preserve occluder_01 screen position, approximate silhouette and textured visible surface; its physical identity remains unassigned.",
        "Preserve source framing, camera, visible street corridor, building contours, visible vehicle and traffic lights only where supported by pixels.",
        "left_facades_01:visible left building facades; clipped at image boundary:PRESERVE_EXACT",
        "occluder_01:dark textured foreground silhouette; physical identity unassigned:PRESERVE_EXACT",
        "right_facades_01:visible right building facades; clipped at image boundary:PRESERVE_EXACT"
      ],
      "target_value": [
        "Preserve occluder_01 screen position, approximate silhouette and textured visible surface; its physical identity remains unassigned.",
        "Preserve source framing, camera, visible street corridor, building contours, visible vehicle and traffic lights only where supported by pixels.",
        "left_facades_01:visible left building facades; clipped at image boundary:PRESERVE_EXACT",
        "occluder_01:dark textured foreground silhouette; physical identity unassigned:PRESERVE_EXACT",
        "right_facades_01:visible right building facades; clipped at image boundary:PRESERVE_EXACT"
      ],
      "expected_lock_ids": [],
      "actual_lock_ids": [],